### ISSUE TITLE
re-registration happens too late

### ISSUE THREAD

**Issue by juha-h** [alfredh/baresip#458]
I have noticed that a UA of my Android baresip app sometimes re-registers itself too late.  Its reg_int is 300 (i.e. 5 minutes) and I have checked that is matches with expires value in Contact header of REGISTER request.

Here is a log sample from my proxy:

Jun 19 18:07:32 box /usr/bin/sip-proxy[24979]: INFO: REGISTER <sip:foo@test.tutpro.com> from <186.238.158.42> using TLSv1.2 is authorized
Jun 19 18:12:03 box /usr/bin/sip-proxy[24981]: INFO: REGISTER <sip:foo@test.tutpro.com> from <186.238.158.42> using TLSv1.2 is authorized
Jun 19 18:16:34 box /usr/bin/sip-proxy[24979]: INFO: REGISTER <sip:foo@test.tutpro.com> from <186.238.158.42> using TLSv1.2 is authorized
Jun 19 18:23:22 box /usr/bin/sip-proxy[24979]: INFO: REGISTER <sip:foo@test.tutpro.com> from <186.238.158.42> using TLSv1.2 is authorized
Jun 19 18:27:53 box /usr/bin/sip-proxy[24979]: INFO: REGISTER <sip:foo@test.tutpro.com> from <186.238.158.42> using TLSv1.2 is authorized
Jun 19 18:34:48 box /usr/bin/sip-proxy[24979]: INFO: REGISTER <sip:foo@test.tutpro.com> from <186.238.158.42> using TLSv1.2 is authorized
Jun 19 18:39:18 box /usr/bin/sip-proxy[24979]: INFO: REGISTER <sip:foo@test.tutpro.com> from <186.238.158.42> using TLSv1.2 is authorized

As you can see sometimes the interval is OK, but sometimes too long (e.g. 7 minutes).

Could this be a bug in baresip?

-- Juha

**Comment by alfredh** [comment]
the re-registration interval is set to 90% of the expires value, so that the
registration can refresh before it expires. see the register client
in libre src/sipreg/reg.c:

```
	else if (msg->scode < 300) {
		reg->registered = true;
		reg->wait = reg->expires;
		sip_msg_hdr_apply(msg, true, SIP_HDR_CONTACT, contact_handler,
				  reg);
		reg->wait *= 900;
		reg->failc = 0;

		if (reg->regid > 0 && !reg->terminated && !reg->ka)
			start_outbound(reg, msg);
	}
```

I tested with baresip and regint=60 on Android, here is the tcpdump
from the SIP server:

```
13:41:07.820579 IP 10.0.0.104.41233 > 10.0.0.4.5060: SIP: REGISTER sip:10.0.0.4 SIP/2.0
13:41:07.823047 IP 10.0.0.4.5060 > 10.0.0.104.41233: SIP: SIP/2.0 200 OK
13:42:03.590223 IP 10.0.0.104.41233 > 10.0.0.4.5060: SIP: REGISTER sip:10.0.0.4 SIP/2.0
13:42:03.590971 IP 10.0.0.4.5060 > 10.0.0.104.41233: SIP: SIP/2.0 200 OK
13:42:57.609080 IP 10.0.0.104.41233 > 10.0.0.4.5060: SIP: REGISTER sip:10.0.0.4 SIP/2.0
13:42:57.609772 IP 10.0.0.4.5060 > 10.0.0.104.41233: SIP: SIP/2.0 200 OK
13:43:51.668500 IP 10.0.0.104.41233 > 10.0.0.4.5060: SIP: REGISTER sip:10.0.0.4 SIP/2.0
13:43:51.669745 IP 10.0.0.4.5060 > 10.0.0.104.41233: SIP: SIP/2.0 200 OK
13:44:45.726141 IP 10.0.0.104.41233 > 10.0.0.4.5060: SIP: REGISTER sip:10.0.0.4 SIP/2.0
13:44:45.727448 IP 10.0.0.4.5060 > 10.0.0.104.41233: SIP: SIP/2.0 200 OK
```

i.e. the interval is around 54 seconds.

please try to run a plain baresip on linux and see if it has the same problem.


Alfred

**Comment by juha-h** [comment]
Alfred E. Heggestad writes:

> please try to run a plain baresip on linux and see if it has the same
> problem.

I'm sure it works fine in Linux, since I have never missed registrations
there.

I'll do more tests later today or tomorrow.  I have one Android device
that always re-registers in timely manner and two where the interval
varies a lot.

-- Juha

**Comment by alfredh** [comment]
you can try to dump the active timers with the `/timers` command:

```
Timers (3):
  0x7ffa88402820: th=0x101efdd40 expire=250ms
  0x7ffa8865d6c8: th=0x101db8780 expire=48372ms
  0x7ffa8861d8f8: th=0x101d6c1f0 expire=54010ms
```

if your regint is 300, then the timers expire value should be around
270 seconds (and counting down).

it is possible that the timers are firing to late, for some reason.
can you try to apply this patch to libre:

```
diff --git a/src/tmr/tmr.c b/src/tmr/tmr.c
index 73083f1..7938df8 100644
--- a/src/tmr/tmr.c
+++ b/src/tmr/tmr.c
@@ -107,6 +107,9 @@ void tmr_poll(struct list *tmrl)
                if (!th)
                        continue;
 
+               re_printf("timer %p expired (delay = %lld ms)\n",
+                         tmr, jfs - tmr->jfs);
+
 #if TMR_DEBUG
                call_handler(th, th_arg);
 #else
```

it will print a message when a timer expires, and the delay
should be around 0-1 ms if everything is normal.

**Comment by juha-h** [comment]
Alfred,

Below is an 'adb logcat' test result with re print patch.  Regint is 600
(10 min).

There is registration after ip address change at 08:01:28.  Then the
next one happens on time at 08:10:29.  Third also happens on time at
08:19:35, but before that there are some large timer delays.  Fourth
registration comes too late at 08:31:20 again preceded by large timer
delays.

What also bothers me is that the last three registrations do not produce
REGISTERING ua_event and '200 OK' log messages.  According to my sip
proxy logs, all registrations worked fine except that the last one came
too late.

-- Juha

06-21 08:00:47.044 16654 16654 D Baresip : ua event (REGISTERING) 
06-21 08:00:47.713 16654 16675 D Baresip : foo@test.tutpro.com: {1/TLS/v4} 200 OK (OpenSIPg SIP Proxy (5.1.2-8 (x86_64/linux))) [1 binding]
06-21 08:00:47.713 16654 16674 D Baresip : ua event (REGISTER_OK) 200 OK
06-21 08:01:28.540 16654 16675 D Baresip : timer 0xa141d928 expired (delay = 0 ms)
06-21 08:01:28.544 16654 16675 D Baresip : net: local IPv4 address changed: 10.25.70.103 -> 10.25.194.29
06-21 08:01:28.544 16654 16675 D Baresip : IP-address changed: 10.25.194.29
06-21 08:01:28.545 16654 16674 D Baresip : ua event (REGISTERING) 
06-21 08:01:29.021 16654 16674 D Baresip : ua event (REGISTER_OK) 200 OK
06-21 08:01:29.024 16654 16675 D Baresip : foo@test.tutpro.com: {1/TLS/v4} 200 OK (OpenSIPg SIP Proxy (5.1.2-8 (x86_64/linux))) [1 binding]
06-21 08:02:28.565 16654 16675 D Baresip : timer 0xa141d928 expired (delay = 24 ms)
06-21 08:03:10.584 16654 16675 D Baresip : timer 0xa87cea20 expired (delay = 44 ms)
06-21 08:03:28.584 16654 16675 D Baresip : timer 0xa141d928 expired (delay = 19 ms)
06-21 08:04:28.645 16654 16675 D Baresip : timer 0xa141d928 expired (delay = 62 ms)
06-21 08:05:02.221 16654 16675 D Baresip : timer 0xa87cea20 expired (delay = 35 ms)
06-21 08:05:28.671 16654 16675 D Baresip : timer 0xa141d928 expired (delay = 26 ms)
06-21 08:06:28.731 16654 16675 D Baresip : timer 0xa141d928 expired (delay = 60 ms)
06-21 08:06:38.952 16654 16675 D Baresip : timer 0xa87cea20 expired (delay = 10 ms)
06-21 08:07:28.783 16654 16675 D Baresip : timer 0xa141d928 expired (delay = 51 ms)
06-21 08:08:18.964 16654 16675 D Baresip : timer 0xa87cea20 expired (delay = 51 ms)
06-21 08:08:28.795 16654 16675 D Baresip : timer 0xa141d928 expired (delay = 12 ms)
06-21 08:09:28.857 16654 16675 D Baresip : timer 0xa141d928 expired (delay = 62 ms)
06-21 08:10:01.599 16654 16675 D Baresip : timer 0xa87cea20 expired (delay = 35 ms)
06-21 08:10:28.887 16654 16675 D Baresip : timer 0xa141d928 expired (delay = 30 ms)
06-21 08:10:29.023 16654 16675 D Baresip : timer 0xa87fdbc8 expired (delay = 2 ms)
06-21 08:10:29.742 16654 16674 D Baresip : ua event (REGISTER_OK) 200 OK
06-21 08:11:28.949 16654 16675 D Baresip : timer 0xa141d928 expired (delay = 62 ms)
06-21 08:11:40.975 16654 16675 D Baresip : timer 0xa87cea20 expired (delay = 14 ms)
06-21 08:12:28.999 16654 16675 D Baresip : timer 0xa141d928 expired (delay = 49 ms)
06-21 08:13:23.992 16654 16675 D Baresip : timer 0xa87cea20 expired (delay = 57 ms)
06-21 08:13:29.005 16654 16675 D Baresip : timer 0xa141d928 expired (delay = 7 ms)
06-21 08:19:34.439 16654 16675 D Baresip : timer 0xa141d928 expired (delay = 305434 ms)
06-21 08:19:34.441 16654 16675 D Baresip : timer 0xa87cea20 expired (delay = 269526 ms)
06-21 08:19:34.441 16654 16675 D Baresip : timer 0xa87fdbc8 expired (delay = 4697 ms)
06-21 08:19:35.432 16654 16674 D Baresip : ua event (REGISTER_OK) 200 OK
06-21 08:20:46.712 16654 16675 D Baresip : timer 0xa141d928 expired (delay = 12272 ms)
06-21 08:21:28.294 16654 16675 D Baresip : timer 0xa87cea20 expired (delay = 3092 ms)
06-21 08:21:49.786 16654 16675 D Baresip : timer 0xa141d928 expired (delay = 3073 ms)
06-21 08:22:55.952 16654 16675 D Baresip : timer 0xa141d928 expired (delay = 6167 ms)
06-21 08:23:15.116 16654 16675 D Baresip : timer 0xa87cea20 expired (delay = 22 ms)
06-21 08:24:06.168 16654 16675 D Baresip : timer 0xa141d928 expired (delay = 10215 ms)
06-21 08:25:14.358 16654 16675 D Baresip : timer 0xa141d928 expired (delay = 8189 ms)
06-21 08:25:14.359 16654 16675 D Baresip : timer 0xa87cea20 expired (delay = 5959 ms)
06-21 08:31:19.968 16654 16675 D Baresip : timer 0xa141d928 expired (delay = 305612 ms)
06-21 08:31:19.970 16654 16675 D Baresip : timer 0xa87cea20 expired (delay = 263489 ms)
06-21 08:31:19.970 16654 16675 D Baresip : timer 0xa87fdbc8 expired (delay = 164537 ms)
06-21 08:31:20.871 16654 16674 D Baresip : ua event (REGISTER_OK) 200 OK

**Comment by alfredh** [comment]
hi @juha-h 

as you can see from this log, something is wrong with the timer system.
this timer is firing more that 300 seconds too late:

```
06-21 08:19:34.439 16654 16675 D Baresip : timer 0xa141d928 expired (delay = 305434 ms)
06-21 08:19:34.441 16654 16675 D Baresip : timer 0xa87cea20 expired (delay = 269526 ms)
```


these kind of problems can be hard to debug.


some thoughts:

* Is the problem present in both your Baresip android app, or also the plain baresip
  running in android terminal ?

* Is the device sleeping or in the background when the timer delay happens ?

* Could there be a clock drift or inaccurate system time
  (tmr.c is using gettimeofday which is using the system time subject to NTP adjustments)

* Is there a function blocking for a very long time ?
  This should be detected by "long async blocking" in tmr.c if compiled with TMR_DEBUG=1

* Could there be a bug in epoll? perhaps test the other async IO methods
  like `poll` and `select`. The epoll_wait function is called with a timeout value
  that is equal to the smallest timer in the timer list (i.e. next one to expire).


I would like to suggest that you create some test code in your application,
that fires a timer on a regular basis. The timer value can be e.g. 60, 120, 300 seconds.
when the timer fires you can measure the actual delay by calling `tmr_jiffies`

**Comment by juha-h** [comment]
Alfred E. Heggestad writes:

> some thoughts:
> 
> * Is the problem present in both your Baresip android app, or also the
>   plain baresip running in android terminal ?

I don't know, since I don't currently have baresip running from
terminal.  This problem appears on my Android 7.0 device, whereas 7.1
device works fine.  So looks like the 7.0 device is giving bogus timing
info to libbaresip.

> * Is the device sleeping or in the background when the timer delay
> * happens ?

In the test that I reported the application was not active (= in
foreground) and the device screen was off. On the other hand, in my
Android app, beresip is started from foreground service that is supposed
to be always running.

> * Could there be a clock drift or inaccurate system time
>   (tmr.c is using gettimeofday which is using the system time subject
>   to NTP adjustments)

I doubt that, but would there be a some other alternative for getting
system time from Android?

> * Is there a function blocking for a very long time ?
>   This should be detected by "long async blocking" in tmr.c if
>   compiled with TMR_DEBUG=1

I have sometimes seen those messages in the log, but usually only during
calls.

> * Could there be a bug in epoll? perhaps test the other async IO methods
>   like `poll` and `select`. The epoll_wait function is called with a
>   timeout value that is equal to the smallest timer in the timer list
>   (i.e. next one to expire).

> I would like to suggest that you create some test code in your application,
> that fires a timer on a regular basis. The timer value can be e.g. 60,
> 120, 300 seconds. when the timer fires you can measure the actual
> delay by calling `tmr_jiffies`.

I could try that, since I have been thinking to handle registrations
from the app, i.e., always use regint=0 and fire ua_register() calls
from the app based on app timer.

-- Juha

**Comment by juha-h** [comment]
I'll close this issue as hopeless.  My baresip app either is not supported on devices where gettimeofday() does not work properly or I'll later do registrations in the app.

**Comment by fwjavox** [comment]
As a "side effect", this could be solved with https://github.com/creytiv/re/pull/222
